<?xml version="1.0" encoding="UTF-8" ?>
<?xml-stylesheet type="text/xsl" href="../xsl_worksheet/ex1/cookbook.xsl"?>

<cookbook xmlns:xsi="http://www.w3.org/2001/XMLSchema-instance"
          xsi:noNamespaceSchemaLocation="ex1.xsd">

    <recipe>
        <author>Gustavo Gião</author>
        <title>Simple Cake</title>
        <ingredients>
            <ingredient>
                <name>Flour</name>
                <quantity>2</quantity>
                <unit>cups</unit>
            </ingredient>
            <ingredient>
                <name>Sugar</name>
                <quantity>1</quantity>
                <unit>cup</unit>
            </ingredient>
        </ingredients>
        <description>Mix the flour and sugar together.</description>
        <calories>500</calories>
    </recipe>

</cookbook>